Lux,pa_26,props/attributes,helmet,A protective device worn on the head,0ac39f79543c4a50a27c7d85341783e6_with_caption,Includes sports and astronaut helmet.,
Lux,pa_27,props/attributes,gun,A firearm,0f989807e3234af4a11b582c3acbd469_with_caption,,
Lux,pa_28,props/attributes,watch,An accessory for the wrist to tell the time,0cc120b78da14a40bf83ad61212b785d_with_caption,"If based on color and thickness of the band it is similar to a watch, it is safe to tag it as watch, even if the clock is not as evident.",
Emanuele,bt_0,body types,non-identifiable gender,"Does not include eyes. Although the face is clearly deformed, it is possible to argue that the subject represents human features. It includes significant deformations, yet the face still retains anthropomorphic characteristics",3b25b37cea3c42a799d127f7e6abe03d_with_caption,,
Emanuele,bt_1,body types,adiposity,"The state of being heavier-set, above average weight",1a33b20964dd4ac491a03ca9fb698657_with_caption,,
Emanuele,bt_2,body types,skinny,"The state of being thinner-set, below average weight",2db7073777b84e4caea50b5e54bcd37f_with_caption,,
Emanuele,bt_3,body types,muscular,"Having well-developed, well-defined muscles",3e5d756ee8e24ae2a0514b9a75d7a961_with_caption,,
Emanuele,bt_4,body types,sagging skin,Loose skin that has little to no definition,65a05c676ba14874a2528d8a29281fbc_with_caption,,
Emanuele,bt_5,body types,wound/scar ,A mark on the body showing the natural healing and replacing of lost skin,5c1d4a54c0a34f31912f9699acbcc46e_with_caption,,
Emanuele,bt_6a,body types,distorted skin,"Skin that is pulled, twisted out of its original shape",8d424773d6eb4ccb9a2aa21102c0d0a3_with_caption,Includes only deformed skin.,
Emanuele,bt_6b,body types,distorted body,"A body that is pulled, twisted out of its original shape",2a0006715a3348f2bd6b392cbbd6cd08_ittgwo_with_caption,Deformation of body parts only is noted. ,
Emanuele,eg_0a,eyes/gaze,downcast eyes,"The eyes are directed downward, not making eye contact with the camera",1a562c236d2c4fc8bc4248781a3d1cd3_with_caption,,
Emanuele,eg_0b,eyes/gaze,looking to the side,"The eyes are turned to the side, and the gaze directed clearly away from the camera",0fbaa332086e4a29b2ef80d4efeaae95_with_caption,,
Emanuele,eg_0c,eyes/gaze,looking up,"The eyes are directed upward, with the gaze clearly focused above the horizontal line of sight",3f208b86781e4c948ceaf29874a22b08_with_caption,Subject must clearly look above themselves.,
Emanuele,eg_1,eyes/gaze,eye contact,"The eyes are pointed directly at the camera, with the gaze clearly focused on the viewer",2b0dda7c497b46ec8ec05afc0d4723d5_ittgwo_with_caption,"The recreated images resemble a photobooth, where, whenever possible, the AI replicates the appearance of a subject as if photographed inside such devices",
Emanuele,eg_2,eyes/gaze,eyes distorted,"One or both eyes appear abnormal or altered in shape, size, or position, such as being stretched, widened, or exaggerated",1c21ed17595141cc8b3dce8ff45392a2_with_caption,"Include minor distortions, as they may appear significant when examined under zoom",
Emanuele,eg_3,eyes/gaze,eyes closed,"The eyelids are fully shut, covering the eyes with no visible openings",78c04cbd829943cab88e31afff1c7b85_with_caption,,
Emanuele,fa_0a,face,uninterpretable,The face is so distorted or abstracted that it no longer resembles a recognizable human face,0e9c5eed18894571847ee895642803ba_with_caption,"Includes highly deformed faces, the malformations are so prevalent that nothing of the face is recognizable.",
Emanuele,fa_0b,face,distorted face,"The face where features such as the nose, mouth, and cheeks are altered, stretched or exaggerated in shape or proportion",0deb04c65d54445eb15842940f22a4fd_with_caption,"Does not include eyes. Although the face is clearly deformed, it is possible to argue that the character represents human features. It includes significant deformations, yet the face still retains anthropomorphic characteristics",
Emanuele,fa_1a,face,covering face,"The hands are placed in front of face, either partially or fully hiding it",0789f3fab0534165b77c55fbc2688533_with_caption,The face or the mouth should be barely noticeable.,
Emanuele,fa_1b,face,mouth covered,"The mouth is obscured or restrained by an object, such as tape, cloth, or another material, preventing it from being visible",3a27ced13c974370a7691d450d4c93cc_with_caption,,
Emanuele,fa_2a,face,smiling with teeth,"A facial expression where the mouth is open, showing visible teeth as part of the smile",2c297c1a24014f0e87246da1f759a4d3_with_caption,,
Emanuele,fa_2b,face,smiling without teeth,"A facial expression where the mouth is curved upward in a smile, but the teeth are not visible",0c47bed74c5a4134804da4cd087a0c35_with_caption.png,,
Emanuele,fa_3,face,big forehead,"The forehead that appears larger than typical, often in proportion to the rest of the face",0b1d1b09637d4b4bb333d735342b723c_with_caption,Includes enlargement that is pronounced and clearly visible.,
Emanuele,fa_4,face,duckface,A facial expression where the lips are pursed and pushed outward,2d029a7f07774056b621b9f5d54c1040_with_caption,,
Emanuele,ea_0,emotion/affect,happy,The subject depicted in the photo seems to express positive emotions,1da807c6ebc04aceaa53730a5c4a32c4_with_caption,,
Emanuele,ea_1,emotion/affect,sad,The subject depicted in the photo seems to express negative emotions,1e2a8153ee55499db85c6d1cf62ee403_with_caption,,